player_id,card_name,card_code,last_sale,last_sale_date,avg_7,avg_30,avg_90,sales_30,active_listings,sell_through,buy_low,buy_high,market_signal,market_note,data_source,source_url
mlb-top100-70,2024 Bowman Chrome Draft 1st Auto Charlie Condon,,14.30,,16.20,19.40,24.10,38,71,35,$12,$18,Strong Buy,"Manual seed comp: recent sale is below the 30-day average while the bat is trending up; verify current market before acting.",Seed comp,https://www.ebay.com/sch/i.html?_nkw=Charlie+Condon+Bowman+1st+Auto&LH_Sold=1&LH_Complete=1
mlb-top100-14,2023 Bowman Chrome Draft 1st Auto Aidan Miller,,62.00,,64.50,58.75,51.20,29,46,39,$55,$66,Buy,"Manual seed comp: price is holding above the 30-day average with strong AAA production; verify current market before acting.",Seed comp,https://www.ebay.com/sch/i.html?_nkw=Aidan+Miller+Bowman+1st+Auto&LH_Sold=1&LH_Complete=1
mlb-top100-11,2023 Bowman Chrome Draft 1st Auto Walker Jenkins,,48.75,,51.10,55.90,61.80,34,63,35,$42,$52,Watch,"Manual seed comp: recent comps are below the 30/90-day baseline, but the market needs either health momentum or louder production.",Seed comp,https://www.ebay.com/sch/i.html?_nkw=Walker+Jenkins+Bowman+1st+Auto&LH_Sold=1&LH_Complete=1
mlb-top100-6,2024 Bowman Chrome Draft 1st Auto Kade Anderson,,39.00,,41.30,36.25,31.40,22,38,37,$34,$43,Buy,"Manual seed comp: pitching prospect prices are volatile; verify current market before acting.",Seed comp,https://www.ebay.com/sch/i.html?_nkw=Kade+Anderson+Bowman+1st+Auto&LH_Sold=1&LH_Complete=1
mlb-top100-1,2024 Bowman Chrome Prospect Auto Jesus Made,CPA-JM,218.00,2026-06-22,,336.00,,,,,$200,$240,Verify Buy,"Sports Card Investor cross-check supplied by Randy: CPA-JM 30-day average $336; last sold 6/22 for $218. This replaces the prior seed comp and should be treated as a manual verified snapshot.",Sports Card Investor cross-check,
mlb-top100-3,2024 Bowman Chrome Draft 1st Auto Seth Hernandez,,84.00,,82.50,74.25,61.80,31,44,41,$72,$88,Buy,"Manual seed comp: rank momentum is already priced in; verify current market before acting.",Seed comp,https://www.ebay.com/sch/i.html?_nkw=Seth+Hernandez+Bowman+1st+Auto&LH_Sold=1&LH_Complete=1
mlb-top100-8,2023 Bowman Chrome 1st Auto Josue De Paula,,92.00,,95.40,101.30,108.20,27,58,32,$82,$96,Watch,"Manual seed comp: market is cooling from the 90-day average; verify current market before acting.",Seed comp,https://www.ebay.com/sch/i.html?_nkw=Josue+De+Paula+Bowman+1st+Auto&LH_Sold=1&LH_Complete=1
mlb-top100-35,2024 Bowman Chrome Draft 1st Auto Kaelen Culpepper,,18.50,,20.25,17.80,15.90,18,29,38,$15,$21,Buy,"Manual seed comp: small-market price point with AAA proximity; verify current market before acting.",Seed comp,https://www.ebay.com/sch/i.html?_nkw=Kaelen+Culpepper+Bowman+1st+Auto&LH_Sold=1&LH_Complete=1
